{"week":"2026-W31","from":"2026-07-27","to":"2026-08-02","total":342,"bySource":{"crossref-journals":49,"arxiv":79,"europepmc":158,"biorxiv":15,"chemrxiv":37,"rss":4},"topIds":["2r27c9l2tc7sl","1c3tmyuk8jzxt","zqa6xvloju11","2b4iu1am3veds","3g6g9pu38z3lf","30o7o8usnux2a","zqtganx9la3g","1nfcoz4k87ow2","2v0oalc13nk3j","351704qii4inp","zpqsiov8nnrr","2pdn92uq8aunm","1a4hh9bxy5h4f","30quqqwg2wbkv","17wfwtvo65dr5"],"rising":[{"chem":"solidstate","cs":"vision-spectra","recent":10,"growth":3.38},{"chem":"nano","cs":"vision-spectra","recent":6,"growth":3.11},{"chem":"nano","cs":"ml","recent":16,"growth":2.83},{"chem":"catalysis","cs":"gnn","recent":5,"growth":2.67},{"chem":"nano","cs":"bayesian-opt","recent":3,"growth":2.67},{"chem":"computational","cs":"generative","recent":8,"growth":2.57}],"quiet":[{"chem":"green","cs":"llm-agent","count":8,"avgScore":47.5},{"chem":"environmental","cs":"robotics","count":5,"avgScore":51.2}]}
