{"week":"2026-W19","from":"2026-05-04","to":"2026-05-10","total":271,"bySource":{"arxiv":91,"europepmc":110,"crossref-journals":25,"chemrxiv":36,"biorxiv":9},"topIds":["tcmizvxhgleb","5hap2f8qibp5","3p51s9p8pyim7","31tnyzrro60e7","1i7brgswhf5hu","nin9jfv16qso","fg96z2bpxc78","3j811h13pzixp","3st1evrybwgis","128ka2agvckfa","tcct08cfue8m","10yizzw837gyz","3dc5znunxk0xl","2smp7d7p26940","2tlp2uya1tsgz"],"rising":[{"chem":"biochem","cs":"ml","recent":57,"growth":58},{"chem":"drug","cs":"ml","recent":54,"growth":55},{"chem":"analytical","cs":"ml","recent":48,"growth":49},{"chem":"solidstate","cs":"ml","recent":43,"growth":44},{"chem":"computational","cs":"ml","recent":29,"growth":30},{"chem":"computational","cs":"simulation","recent":28,"growth":29}],"quiet":[{"chem":"computational","cs":"rl","count":17,"avgScore":46.8},{"chem":"nano","cs":"robotics","count":10,"avgScore":54}]}
