{"week":"2026-W38","from":"2026-09-14","to":"2026-09-20","total":239,"bySource":{"arxiv":89,"europepmc":77,"crossref-journals":29,"biorxiv":9,"chemrxiv":33,"rss":2},"topIds":["320tnw6ow2vvk","1dnkor49z5u20","30fd12rudlooq","1qdlkplnf7hta","p19welbls611","1uvy2jypgqo20","18cimpwbwolbc","29ed7o88k8717","1dl6qynnwu3qr","1vgg6rq0ma4fx","3h8l85ro8jj8p","3ku3friockzq4","1942whnglgjr6","3estjja4zto1j","9qzdtckkilvr"],"rising":[{"chem":"computational","cs":"rl","recent":3,"growth":4},{"chem":"polymers","cs":"transformer","recent":3,"growth":3.2},{"chem":"electrochem","cs":"vision-spectra","recent":2,"growth":3},{"chem":"catalysis","cs":"quantum-computing","recent":2,"growth":3},{"chem":"energy","cs":"digital-twin","recent":4,"growth":2.86},{"chem":"computational","cs":"data-standards","recent":5,"growth":2.67}],"quiet":[{"chem":"computational","cs":"rl","count":17,"avgScore":46.8},{"chem":"synthesis","cs":"hpc","count":5,"avgScore":47.2}]}
