{"week":"2026-W20","from":"2026-05-11","to":"2026-05-17","total":281,"bySource":{"europepmc":108,"chemrxiv":29,"arxiv":105,"crossref-journals":20,"biorxiv":18,"rss":1},"topIds":["15ldml4g4w0rf","2c30uk44080at","25x3l07z2e4d5","1o0jvjamfrj0a","2zv7o5wukubr1","2nqcfzws8ih9v","2jofwo2d3jfi2","3su2fik3esmj2","1awnvve4pse1g","26pzv9vqar7fn","1fbcm52wxvnqa","2l3s1cwp0rxd1","nb0xxt1bzvvf","qnb87a4idn51","36e6nndmfffmz"],"rising":[{"chem":"energy","cs":"transformer","recent":4,"growth":5},{"chem":"analytical","cs":"data-standards","recent":3,"growth":4},{"chem":"nano","cs":"transformer","recent":3,"growth":4},{"chem":"catalysis","cs":"llm-agent","recent":3,"growth":4},{"chem":"polymers","cs":"gnn","recent":3,"growth":4},{"chem":"energy","cs":"ml","recent":12,"growth":3.25}],"quiet":[{"chem":"analytical","cs":"knowledge-graph","count":14,"avgScore":47.9},{"chem":"polymers","cs":"gnn","count":14,"avgScore":51.9},{"chem":"electrochem","cs":"llm-agent","count":6,"avgScore":58.5},{"chem":"synthesis","cs":"active-learning","count":6,"avgScore":48.3},{"chem":"environmental","cs":"robotics","count":5,"avgScore":51.2},{"chem":"green","cs":"rl","count":5,"avgScore":47}]}
