{"week":"2026-W42","from":"2026-10-12","to":"2026-10-18","total":248,"bySource":{"europepmc":60,"arxiv":95,"chemrxiv":38,"biorxiv":18,"crossref-journals":28,"rss":9},"topIds":["18wzhhjbejqqt","10sy9szuxdiwd","3d5jq30tcsj58","3nmvpmln84fwk","3qdbago46su37","28syxy5m77wce","3qayswc2cclqo","7gassba2ds94","ge7uo9q8rl7g","14r7n62n4qdzw","2nq99feyud284","1vg7sfvict5e1","kwip5kn7q19s","3qaf4oth5rs0y","23rks4njyxl24"],"rising":[{"chem":"biochem","cs":"active-learning","recent":7,"growth":2.67},{"chem":"analytical","cs":"bayesian-opt","recent":3,"growth":2.67},{"chem":"drug","cs":"active-learning","recent":5,"growth":2.4},{"chem":"environmental","cs":"digital-twin","recent":2,"growth":2.4},{"chem":"general","cs":"ml","recent":12,"growth":2.36},{"chem":"polymers","cs":"generative","recent":3,"growth":2}],"quiet":[{"chem":"drug","cs":"quantum-computing","count":14,"avgScore":48.4},{"chem":"environmental","cs":"robotics","count":5,"avgScore":51.2},{"chem":"green","cs":"rl","count":5,"avgScore":47}]}
