{"week":"2026-W39","from":"2026-09-21","to":"2026-09-27","total":238,"bySource":{"arxiv":88,"europepmc":80,"crossref-journals":26,"biorxiv":12,"chemrxiv":30,"rss":2},"topIds":["3tw5gznpg4m5s","2o6zt4cdklk2m","2yx4cwgwpvmv0","38jg9zs2d9axz","14e6jmfpyj2ku","369emrjk0mevu","29gh9o6xvjxs4","3ey7kuxd172dx","j9rqbzc40ru2","2tv0p49tyk6ff","2t7huy5x1ohfs","2t7hwwbglurif","24gwe2ih73bwe","2g6d87snockmy","3lqq5ype9p0b0"],"rising":[{"chem":"catalysis","cs":"bayesian-opt","recent":5,"growth":3},{"chem":"solidstate","cs":"rl","recent":5,"growth":3},{"chem":"electrochem","cs":"llm-agent","recent":2,"growth":3},{"chem":"energy","cs":"quantum-computing","recent":2,"growth":2.4},{"chem":"energy","cs":"simulation","recent":6,"growth":2},{"chem":"general","cs":"simulation","recent":2,"growth":2}],"quiet":[{"chem":"computational","cs":"rl","count":17,"avgScore":46.8},{"chem":"environmental","cs":"transformer","count":17,"avgScore":48.2},{"chem":"green","cs":"generative","count":14,"avgScore":50.2},{"chem":"nano","cs":"robotics","count":10,"avgScore":54},{"chem":"electrochem","cs":"llm-agent","count":6,"avgScore":58.5},{"chem":"environmental","cs":"generative","count":6,"avgScore":50}]}
