{"week":"2026-W29","from":"2026-07-13","to":"2026-07-19","total":265,"bySource":{"europepmc":104,"arxiv":76,"crossref-journals":40,"chemrxiv":37,"biorxiv":8},"topIds":["341ithzej6j55","2u9le0gghp50m","10du7xlydyf6m","s7qncfuhguox","25d9fzug45vgz","1m2bxwj2m2f3k","ogooi2h51idu","3n339m47ams4","1n3pmicq2neyy","1h1rdr8q31jnh","1bp5qmx0herng","3nbi7f4cvx8jq","2h7nr681fyo8h","1dvk7zfcgv1wj","25d9hxzzoc5jm"],"rising":[{"chem":"catalysis","cs":"bayesian-opt","recent":4,"growth":2.5},{"chem":"general","cs":"transformer","recent":2,"growth":2.4},{"chem":"green","cs":"simulation","recent":2,"growth":2.4},{"chem":"energy","cs":"digital-twin","recent":3,"growth":2.29},{"chem":"energy","cs":"transformer","recent":4,"growth":2},{"chem":"catalysis","cs":"generative","recent":3,"growth":2}],"quiet":[{"chem":"computational","cs":"rl","count":17,"avgScore":46.8},{"chem":"polymers","cs":"gnn","count":14,"avgScore":51.9},{"chem":"environmental","cs":"generative","count":6,"avgScore":50}]}
