{"week":"2026-W23","from":"2026-06-01","to":"2026-06-07","total":334,"bySource":{"europepmc":161,"arxiv":84,"biorxiv":15,"chemrxiv":49,"crossref-journals":25},"topIds":["1ijducz8b1an7","1dketek8426l7","pbzrushz3yxh","2irqjbhkul7lj","3ctoghajhxx05","33z4x9n8470w0","2zh8jzgrtae6r","3vv2nr5do7hl2","1sbdwjfq6g2xe","u7291w5frayi","1omun87hcyva4","2qoov2rcp23m1","23zfws8hjk8av","9f2f5ftn0mzs","3uxgyqhef9sv8"],"rising":[{"chem":"drug","cs":"knowledge-graph","recent":3,"growth":4},{"chem":"general","cs":"gnn","recent":4,"growth":2.86},{"chem":"synthesis","cs":"ml","recent":8,"growth":2.4},{"chem":"drug","cs":"digital-twin","recent":2,"growth":2.4},{"chem":"electrochem","cs":"digital-twin","recent":2,"growth":2.4},{"chem":"general","cs":"quantum-computing","recent":2,"growth":2.4}],"quiet":[{"chem":"computational","cs":"rl","count":17,"avgScore":46.8},{"chem":"polymers","cs":"gnn","count":14,"avgScore":51.9},{"chem":"nano","cs":"robotics","count":10,"avgScore":54},{"chem":"green","cs":"llm-agent","count":8,"avgScore":47.5},{"chem":"environmental","cs":"generative","count":6,"avgScore":50},{"chem":"green","cs":"gnn","count":3,"avgScore":56.7}]}
