{"week":"2026-W44","from":"2026-10-26","to":"2026-11-01","total":182,"bySource":{"crossref-journals":37,"arxiv":53,"europepmc":35,"chemrxiv":34,"biorxiv":12,"rss":11},"topIds":["345jq4i92fyoq","2r2z7uvweu5iv","39svhfem6s28c","xj5fk32999lp","3fw0fupqy44f1","1bjjyg1n0jjjs","1hlzgv4nmbdnl","uf358z46t4f6","33cz06lwa0ayi","isem6ql0m2gh","37m2piqqqmzsm","3461szxq8hb5m","2ypxggdpaiakj","1eqs11cp2zwa4","1zs8w39my8i62"],"rising":[{"chem":"green","cs":"generative","recent":2,"growth":3},{"chem":"general","cs":"llm-agent","recent":3,"growth":2.67},{"chem":"general","cs":"gnn","recent":4,"growth":2.5},{"chem":"analytical","cs":"hpc","recent":2,"growth":2.4},{"chem":"biochem","cs":"knowledge-graph","recent":3,"growth":2.29},{"chem":"catalysis","cs":"robotics","recent":2,"growth":2}],"quiet":[{"chem":"computational","cs":"rl","count":17,"avgScore":46.8},{"chem":"environmental","cs":"transformer","count":17,"avgScore":48.2},{"chem":"analytical","cs":"knowledge-graph","count":14,"avgScore":47.9},{"chem":"green","cs":"generative","count":14,"avgScore":50.2},{"chem":"green","cs":"rl","count":5,"avgScore":47},{"chem":"synthesis","cs":"hpc","count":5,"avgScore":47.2}]}
