{"week":"2026-W21","from":"2026-05-18","to":"2026-05-24","total":297,"bySource":{"arxiv":92,"chemrxiv":47,"europepmc":115,"crossref-journals":20,"biorxiv":22,"rss":1},"topIds":["24ygrpfp5g7kv","1j8qabqj76668","3jm18vz1syzz0","1oh43vm7tmak4","7z82jmiirl77","f87xlenupbde","19kmtoybdb1z5","yyva7jyr2i3q","3bliwwqisbgi7","266a09tqvr4bo","3i0pc112n6ale","3pfq074xjjd5d","3b93vuuajrf9r","39sub9yqaxxsk","3lfxleahk0ark"],"rising":[{"chem":"synthesis","cs":"robotics","recent":3,"growth":4},{"chem":"polymers","cs":"simulation","recent":5,"growth":3},{"chem":"green","cs":"bayesian-opt","recent":2,"growth":3},{"chem":"green","cs":"simulation","recent":2,"growth":3},{"chem":"electrochem","cs":"active-learning","recent":2,"growth":3},{"chem":"nano","cs":"llm-agent","recent":2,"growth":3}],"quiet":[{"chem":"synthesis","cs":"robotics","count":15,"avgScore":49.9},{"chem":"polymers","cs":"gnn","count":14,"avgScore":51.9},{"chem":"electrochem","cs":"robotics","count":13,"avgScore":47.6},{"chem":"nano","cs":"robotics","count":10,"avgScore":54},{"chem":"green","cs":"llm-agent","count":8,"avgScore":47.5},{"chem":"synthesis","cs":"active-learning","count":6,"avgScore":48.3}]}
