{"week":"2026-W37","from":"2026-09-07","to":"2026-09-13","total":261,"bySource":{"arxiv":71,"crossref-journals":21,"europepmc":112,"biorxiv":13,"chemrxiv":41,"rss":3},"topIds":["2ftvoazvnf5z6","1tluxioip7a0l","2n6j6p5ockq4t","3eeku0nb9r372","3euixzuq99mj8","13m6qydzgwcx","23kj2ompl3umv","ftb6w2kmhkb8","2vnx4uxfn3lib","3ek6pk3l1raba","1itb45enh2i4f","1b4zutq3gqxio","1lmt0vmxxw8b7","3saffcnb3vxrh","2xeqz0n0yrxh6"],"rising":[{"chem":"synthesis","cs":"robotics","recent":3,"growth":3.2},{"chem":"general","cs":"active-learning","recent":2,"growth":3},{"chem":"catalysis","cs":"robotics","recent":3,"growth":2.67},{"chem":"general","cs":"generative","recent":3,"growth":2.67},{"chem":"general","cs":"transformer","recent":4,"growth":2.5},{"chem":"general","cs":"simulation","recent":2,"growth":2.4}],"quiet":[{"chem":"synthesis","cs":"robotics","count":15,"avgScore":49.9},{"chem":"analytical","cs":"knowledge-graph","count":14,"avgScore":47.9},{"chem":"environmental","cs":"rl","count":3,"avgScore":49.7}]}
