{"week":"2026-W25","from":"2026-06-15","to":"2026-06-21","total":272,"bySource":{"arxiv":77,"europepmc":117,"chemrxiv":34,"crossref-journals":31,"biorxiv":13},"topIds":["2zvroeco9d6y5","170qnkfk6byi6","15soma91lp8vw","23m8osg8nkji3","lwghbu8fcyla","3sig19q3llsb3","1kj5y8mbv3h71","3172ck32icrrt","2uas6jcienrtw","ydy7t885wj96","izdb5jjp5kaa","19c8v0vgvanwx","1kzo6gv1r56ah","23let0ir5i3xp","38o3eb32tu7sj"],"rising":[{"chem":"catalysis","cs":"robotics","recent":2,"growth":3},{"chem":"general","cs":"data-standards","recent":2,"growth":3},{"chem":"solidstate","cs":"rl","recent":2,"growth":2.4},{"chem":"catalysis","cs":"hpc","recent":2,"growth":2.4},{"chem":"general","cs":"bayesian-opt","recent":2,"growth":2.4},{"chem":"environmental","cs":"vision-spectra","recent":3,"growth":2.29}],"quiet":[{"chem":"synthesis","cs":"gnn","count":17,"avgScore":52.1},{"chem":"electrochem","cs":"robotics","count":13,"avgScore":47.6},{"chem":"nano","cs":"robotics","count":10,"avgScore":54},{"chem":"green","cs":"llm-agent","count":8,"avgScore":47.5},{"chem":"synthesis","cs":"rl","count":7,"avgScore":48.4},{"chem":"environmental","cs":"robotics","count":5,"avgScore":51.2}]}
