{"week":"2026-W32","from":"2026-08-03","to":"2026-08-09","total":235,"bySource":{"arxiv":71,"chemrxiv":28,"europepmc":88,"crossref-journals":20,"biorxiv":23,"rss":5},"topIds":["150khi0ms7kku","ty9938cxou57","31l60fvwikuwb","yaaea92pvwug","l12e2fuod9gk","1q5hcb17ixptx","28sbytcne4rek","278lnp1kr86g7","8kpqg8vxyqhk","g1hd37sns77j","11krbovlh82ob","12ao7m0732zb8","178g7bgdyzppz","3dm8zj8wrxiwt","2yi1eyqweglqa"],"rising":[{"chem":"computational","cs":"data-standards","recent":5,"growth":3.43},{"chem":"computational","cs":"quantum-computing","recent":9,"growth":2.86},{"chem":"analytical","cs":"bayesian-opt","recent":3,"growth":2.67},{"chem":"computational","cs":"vision-spectra","recent":3,"growth":2.67},{"chem":"drug","cs":"robotics","recent":2,"growth":2.4},{"chem":"polymers","cs":"llm-agent","recent":2,"growth":2.4}],"quiet":[{"chem":"synthesis","cs":"robotics","count":15,"avgScore":49.9},{"chem":"nano","cs":"robotics","count":10,"avgScore":54},{"chem":"green","cs":"rl","count":5,"avgScore":47}]}
