{"week":"2026-W43","from":"2026-10-19","to":"2026-10-25","total":214,"bySource":{"arxiv":96,"crossref-journals":25,"europepmc":35,"chemrxiv":32,"biorxiv":17,"rss":9},"topIds":["3vzpv5x6laq0k","102s03houwnfs","9ys5pc6wl464","3kp49yy610ber","1jr991upn8ivr","11vvh8m0tesa","2tjnprjfykftz","jqxwtnrwf5q6","3rzfdhn9fqb5v","3nuszs086oo3f","1lftcwl10lz9j","2mcbh19s2a1ap","1rpoholm27dtw","11kjjc7q98jwn","2mwtd107qn0oq"],"rising":[{"chem":"analytical","cs":"transformer","recent":10,"growth":2.75},{"chem":"solidstate","cs":"quantum-computing","recent":3,"growth":2.67},{"chem":"catalysis","cs":"active-learning","recent":4,"growth":2.5},{"chem":"catalysis","cs":"robotics","recent":2,"growth":2.4},{"chem":"analytical","cs":"active-learning","recent":4,"growth":2},{"chem":"catalysis","cs":"digital-twin","recent":2,"growth":2}],"quiet":[{"chem":"electrochem","cs":"robotics","count":13,"avgScore":47.6},{"chem":"synthesis","cs":"rl","count":7,"avgScore":48.4},{"chem":"electrochem","cs":"llm-agent","count":6,"avgScore":58.5}]}
