{"week":"2026-W34","from":"2026-08-17","to":"2026-08-23","total":225,"bySource":{"europepmc":69,"arxiv":77,"biorxiv":24,"chemrxiv":27,"crossref-journals":28},"topIds":["1ftx0jnp2deah","1ljkgwvb1y9z0","3dmb7qkalqtsi","2idg5hzls0p0p","w44uftpc79cd","1z3mhf7uwo4ox","26o7rx0kojees","22fewu6n4042s","1z6qsmp6sg0p3","3bqgbmg1pozps","33trulz5liu5u","37t1kj2uxzdx","hx7sxihcmi2a","3joswykclobcy","1dxkw923sqotn"],"rising":[{"chem":"energy","cs":"bayesian-opt","recent":2,"growth":3},{"chem":"electrochem","cs":"generative","recent":2,"growth":3},{"chem":"energy","cs":"generative","recent":4,"growth":2.86},{"chem":"nano","cs":"bayesian-opt","recent":4,"growth":2.86},{"chem":"synthesis","cs":"llm-agent","recent":2,"growth":2.4},{"chem":"polymers","cs":"bayesian-opt","recent":2,"growth":2}],"quiet":[{"chem":"synthesis","cs":"active-learning","count":6,"avgScore":48.3}]}
