{"week":"2026-W36","from":"2026-08-31","to":"2026-09-06","total":367,"bySource":{"europepmc":168,"arxiv":101,"chemrxiv":44,"crossref-journals":45,"biorxiv":8,"rss":1},"topIds":["1zo1q2jdh5pwn","3koza1up08zbt","2f3wttylbxevn","ficixytsw8j1","2qp1jw3lolizw","1lcpn15g47t8y","2s7dh9azyldct","2ben68vyrijww","c2yvwm8llesl","1s6r0uddy0wzj","2ocaoa1g39ywx","3mgg7qh2ilmbc","1g8yeyjtsx0lv","3jni9kl65i3ra","2ze31d1tc41ua"],"rising":[{"chem":"nano","cs":"simulation","recent":6,"growth":3.5},{"chem":"computational","cs":"hpc","recent":9,"growth":3.33},{"chem":"polymers","cs":"generative","recent":4,"growth":3.33},{"chem":"synthesis","cs":"simulation","recent":4,"growth":3.33},{"chem":"drug","cs":"knowledge-graph","recent":3,"growth":3.2},{"chem":"green","cs":"generative","recent":2,"growth":3}],"quiet":[{"chem":"environmental","cs":"transformer","count":17,"avgScore":48.2},{"chem":"green","cs":"generative","count":14,"avgScore":50.2},{"chem":"environmental","cs":"generative","count":6,"avgScore":50},{"chem":"catalysis","cs":"knowledge-graph","count":3,"avgScore":52.7}]}
