{"week":"2026-W28","from":"2026-07-06","to":"2026-07-12","total":272,"bySource":{"arxiv":78,"europepmc":114,"crossref-journals":32,"chemrxiv":30,"biorxiv":18},"topIds":["2iewp2h6rsycc","128p29homhboj","1b1kmg1mid87d","2z0er2xo00jil","2edjjm87lax5y","17ttpnx56x09g","ubtxcras4ywv","1nuxnasdkr5kw","1tpzv8y60yret","crp8dg95eoxv","30m6yxrnr1ezb","2gitn45yfxdlw","25yxswjy3q19f","2mp7c81ml8cb9","30ql1jb2uy8g8"],"rising":[{"chem":"nano","cs":"transformer","recent":3,"growth":2.67},{"chem":"catalysis","cs":"transformer","recent":5,"growth":2.4},{"chem":"catalysis","cs":"active-learning","recent":2,"growth":2.4},{"chem":"catalysis","cs":"data-standards","recent":2,"growth":2.4},{"chem":"nano","cs":"digital-twin","recent":2,"growth":2.4},{"chem":"energy","cs":"bayesian-opt","recent":3,"growth":2.29}],"quiet":[{"chem":"synthesis","cs":"robotics","count":15,"avgScore":49.9},{"chem":"nano","cs":"robotics","count":10,"avgScore":54},{"chem":"green","cs":"llm-agent","count":8,"avgScore":47.5},{"chem":"synthesis","cs":"rl","count":7,"avgScore":48.4}]}
