{"week":"2026-W26","from":"2026-06-22","to":"2026-06-28","total":265,"bySource":{"arxiv":79,"europepmc":119,"chemrxiv":34,"biorxiv":14,"crossref-journals":19},"topIds":["chwetcjvd3wh","1aeb7qm7ekhe4","22ka9ths17an7","3mh9cr87oi6k4","1vtbzid25mfg0","4vsk4yudfv29","1hyq0sebkx5l","2m5vmh2zwn9ai","4306outyxtvo","22h5zs3rvxkom","inq3c32c8azr","3smnkueydlx3a","ekjz10ysctvx","mbse4nfnppig","22kaehv2z7ytj"],"rising":[{"chem":"energy","cs":"simulation","recent":5,"growth":3.43},{"chem":"environmental","cs":"transformer","recent":2,"growth":3},{"chem":"analytical","cs":"quantum-computing","recent":4,"growth":2.86},{"chem":"drug","cs":"quantum-computing","recent":2,"growth":2.4},{"chem":"computational","cs":"quantum-computing","recent":7,"growth":2.29},{"chem":"computational","cs":"llm-agent","recent":6,"growth":2}],"quiet":[{"chem":"environmental","cs":"transformer","count":17,"avgScore":48.2},{"chem":"analytical","cs":"knowledge-graph","count":14,"avgScore":47.9},{"chem":"drug","cs":"quantum-computing","count":14,"avgScore":48.4},{"chem":"polymers","cs":"gnn","count":14,"avgScore":51.9},{"chem":"synthesis","cs":"rl","count":7,"avgScore":48.4},{"chem":"synthesis","cs":"hpc","count":5,"avgScore":47.2}]}
