{"week":"2026-W40","from":"2026-09-28","to":"2026-10-04","total":362,"bySource":{"arxiv":137,"europepmc":130,"crossref-journals":42,"chemrxiv":29,"biorxiv":22,"rss":2},"topIds":["1pzh70jfxp7ew","31g0ky0e37cgx","1ifyffosmk5up","24zj3szj3n56m","126z96xj6ejb2","14pwnof0pvsel","1lfa0tky1q53f","g069ccvir1ee","rck49ricbb3m","2ofju2sc12gdd","c2ytygp1f4py","2dnqx3xk6khbu","2513zish5gu62","1uvfy4esnd3j0","23xfed4vu83kw"],"rising":[{"chem":"biochem","cs":"hpc","recent":5,"growth":4.8},{"chem":"nano","cs":"generative","recent":4,"growth":4},{"chem":"energy","cs":"gnn","recent":3,"growth":3.2},{"chem":"green","cs":"active-learning","recent":2,"growth":3},{"chem":"biochem","cs":"rl","recent":4,"growth":2.86},{"chem":"biochem","cs":"bayesian-opt","recent":6,"growth":2.8}],"quiet":[{"chem":"synthesis","cs":"robotics","count":15,"avgScore":49.9},{"chem":"drug","cs":"quantum-computing","count":14,"avgScore":48.4},{"chem":"green","cs":"llm-agent","count":8,"avgScore":47.5}]}
