{"week":"2026-W22","from":"2026-05-25","to":"2026-05-31","total":298,"bySource":{"crossref-journals":29,"arxiv":97,"europepmc":121,"biorxiv":16,"chemrxiv":35},"topIds":["35po6ywmr2goq","1s7lu7x3vto6d","2ae8ctavfzlvx","3gur4xiet0yq7","24wlv2v71q44","2liec6zgww7sh","238d8nq6vxopr","1sb9k8ma4bsgc","3ob0b8b5sr5u0","jx3unh6low4b","2jgu2t82vd2si","y2kaabik1oua","3qtz7cdkt3blb","1y90eekdopfd5","12untojg9snju"],"rising":[{"chem":"polymers","cs":"bayesian-opt","recent":2,"growth":3},{"chem":"environmental","cs":"data-standards","recent":2,"growth":3},{"chem":"computational","cs":"generative","recent":7,"growth":2.67},{"chem":"catalysis","cs":"active-learning","recent":3,"growth":2.4},{"chem":"drug","cs":"vision-spectra","recent":6,"growth":2.33},{"chem":"energy","cs":"generative","recent":2,"growth":2.25}],"quiet":[{"chem":"computational","cs":"rl","count":17,"avgScore":46.8},{"chem":"polymers","cs":"gnn","count":14,"avgScore":51.9},{"chem":"electrochem","cs":"robotics","count":13,"avgScore":47.6}]}
