{"week":"2026-W41","from":"2026-10-05","to":"2026-10-11","total":282,"bySource":{"crossref-journals":35,"arxiv":127,"europepmc":63,"biorxiv":15,"chemrxiv":40,"rss":2},"topIds":["2pn5it285kr06","1ynqmw2j1ajiu","1kekh3cv9lird","18r3jcftfg28w","2iec7jjnyoi9n","1t4oou24rp3f8","2h1z11k04nxu5","2ntobazrmk9z2","2qyplp8uub7po","3kg0rzvtnbolb","1h76wh1wsrw7","34jlgzkw908qt","2mkm60gps2jzq","2u8x2jlpcutj0","30o0iptab2tws"],"rising":[{"chem":"electrochem","cs":"transformer","recent":2,"growth":3},{"chem":"environmental","cs":"llm-agent","recent":2,"growth":3},{"chem":"synthesis","cs":"gnn","recent":2,"growth":2.4},{"chem":"synthesis","cs":"data-standards","recent":2,"growth":2.4},{"chem":"synthesis","cs":"ml","recent":8,"growth":2.25},{"chem":"computational","cs":"transformer","recent":9,"growth":2}],"quiet":[{"chem":"synthesis","cs":"gnn","count":17,"avgScore":52.1},{"chem":"synthesis","cs":"rl","count":7,"avgScore":48.4},{"chem":"electrochem","cs":"llm-agent","count":6,"avgScore":58.5},{"chem":"synthesis","cs":"active-learning","count":6,"avgScore":48.3}]}
