{"week":"2026-W24","from":"2026-06-08","to":"2026-06-14","total":324,"bySource":{"arxiv":110,"europepmc":133,"crossref-journals":27,"biorxiv":17,"chemrxiv":37},"topIds":["1jah0vjwa9x8w","31dir6cffi6ld","b135veoyz1nd","37hde3u10d1gy","vsjj2yzd6v7p","1bdgrjpa2wvyd","47nz9r0josga","2stt8shyv6ntk","3dmuitwhtskp5","2htlv3hj5rez7","1fc5q5w4ijz4q","28m7hnr4wt06v","3ol88yw5vkx47","d85w9wfzsmsk","3czemocqlj5vo"],"rising":[{"chem":"drug","cs":"knowledge-graph","recent":6,"growth":4},{"chem":"green","cs":"generative","recent":3,"growth":3.2},{"chem":"general","cs":"gnn","recent":5,"growth":3},{"chem":"energy","cs":"quantum-computing","recent":2,"growth":3},{"chem":"biochem","cs":"bayesian-opt","recent":6,"growth":2.8},{"chem":"solidstate","cs":"quantum-computing","recent":6,"growth":2.8}],"quiet":[{"chem":"synthesis","cs":"gnn","count":17,"avgScore":52.1},{"chem":"synthesis","cs":"robotics","count":15,"avgScore":49.9},{"chem":"drug","cs":"quantum-computing","count":14,"avgScore":48.4},{"chem":"green","cs":"generative","count":14,"avgScore":50.2},{"chem":"green","cs":"llm-agent","count":8,"avgScore":47.5},{"chem":"environmental","cs":"generative","count":6,"avgScore":50}]}
