{"week":"2026-W35","from":"2026-08-24","to":"2026-08-30","total":290,"bySource":{"chemrxiv":44,"crossref-journals":40,"arxiv":76,"europepmc":108,"biorxiv":19,"rss":3},"topIds":["3on9rds2pxshm","1ctg244d72ch7","11uozczm04fn","5p3vrd3glmbi","3risa3fp3qmvg","361cwf67k2jir","3ja7jwdz6ja9l","lopuvy0ddiq6","12xh1o8o4cx5","1peb3fnwg4u63","1zxd5qi6g7958","3046rq8y6j3tf","hmb9b65bg4v7","3g6tcn73w0h6m","2cjonapqqzdax"],"rising":[{"chem":"synthesis","cs":"gnn","recent":3,"growth":3.2},{"chem":"biochem","cs":"llm-agent","recent":8,"growth":3},{"chem":"synthesis","cs":"transformer","recent":4,"growth":2.86},{"chem":"polymers","cs":"ml","recent":11,"growth":2.53},{"chem":"biochem","cs":"rl","recent":2,"growth":2.4},{"chem":"polymers","cs":"data-standards","recent":2,"growth":2.4}],"quiet":[{"chem":"synthesis","cs":"gnn","count":17,"avgScore":52.1},{"chem":"analytical","cs":"knowledge-graph","count":14,"avgScore":47.9},{"chem":"drug","cs":"quantum-computing","count":14,"avgScore":48.4},{"chem":"electrochem","cs":"robotics","count":13,"avgScore":47.6},{"chem":"synthesis","cs":"rl","count":7,"avgScore":48.4},{"chem":"green","cs":"gnn","count":3,"avgScore":56.7}]}
