{"week":"2026-W27","from":"2026-06-29","to":"2026-07-05","total":313,"bySource":{"crossref-journals":30,"europepmc":149,"chemrxiv":45,"arxiv":72,"biorxiv":16,"rss":1},"topIds":["2ymsj1kp5bqrn","5tahvkxqmqj5","2m6i8t6noa6r0","1ii2q6yay60vk","urgwkc1owj53","1vutjxqnrlw5b","1qurd9wgj5l0d","2lsoblci9dlno","1iiciisjgsk4f","1ng4kyghqjomv","1t7lcnrxdsj78","x4qbej92fl1z","3vejqr1bvs9sq","2m577ddhp9b32","1yok6tlj2z9go"],"rising":[{"chem":"computational","cs":"hpc","recent":7,"growth":2.91},{"chem":"catalysis","cs":"robotics","recent":4,"growth":2.86},{"chem":"solidstate","cs":"hpc","recent":6,"growth":2.8},{"chem":"electrochem","cs":"robotics","recent":3,"growth":2.67},{"chem":"biochem","cs":"data-standards","recent":10,"growth":2.59},{"chem":"analytical","cs":"knowledge-graph","recent":2,"growth":2.4}],"quiet":[{"chem":"analytical","cs":"knowledge-graph","count":14,"avgScore":47.9},{"chem":"drug","cs":"quantum-computing","count":14,"avgScore":48.4},{"chem":"green","cs":"generative","count":14,"avgScore":50.2},{"chem":"electrochem","cs":"robotics","count":13,"avgScore":47.6}]}
